{
  "schema_version": "translation-task/v1",
  "id": "verify-matplotlib-matplotlib",
  "kind": "verification",
  "status": "blocked",
  "title": {
    "ja": "Matplotlib のドキュメント日本語化の検証",
    "en": null
  },
  "project": {
    "repository": "matplotlib/matplotlib",
    "url": "https://github.com/matplotlib/matplotlib",
    "category": "Python",
    "summary_ja": "Python 標準の可視化ライブラリ。README 繁体字中国語訳の PR がメンテナ合議で却下され、「複数言語のドキュメントは維持しない」との決定が明言された。Scientific Python Translations の対象にも matplotlib は含まれておらず、リポジトリへの翻訳貢献は現状受け付けられない。PR テンプレートには AI 利用の開示欄がある。",
    "license": "PSF-based (Matplotlib License)"
  },
  "source": {
    "revision": null,
    "paths": []
  },
  "target": {
    "locale": "ja-JP",
    "paths": []
  },
  "permissions": {
    "translation": "forbidden",
    "ai_assistance": "disclose",
    "pull_request": "forbidden"
  },
  "automation": {
    "level": "blocked",
    "allowed_actions": [
      "inspect_public_metadata",
      "find_translation_policy",
      "find_existing_work",
      "report_evidence"
    ]
  },
  "evidence": [
    {
      "url": "https://github.com/matplotlib/matplotlib",
      "kind": "repository",
      "observed_at": "2026-08-02",
      "note_ja": "リポジトリの存在と活動を確認。"
    },
    {
      "url": "https://scientific-python-translations.github.io/translate/",
      "kind": "translation_policy",
      "observed_at": "2026-08-03",
      "note_ja": "Scientific Python Translations（Crowdin、日本語対象あり、参加は Discord #translation 経由）の対象プロジェクトは Pandas/NumPy/Xarray/SciPy/Zarr/NetworkX で、matplotlib は含まれていない。matplotlib 本体・matplotlib.org にもドキュメント翻訳の受付方針は見つからず、日本語化の受け入れ経路は未確立のまま。"
    },
    {
      "url": "https://api.github.com/repos/matplotlib/matplotlib",
      "kind": "repository",
      "observed_at": "2026-08-03",
      "note_ja": "main ブランチが活発（最終 push 2026-08-01）、Star 23,057、アーカイブされていないことを確認。ライセンスは PSF ベースの独自ライセンス（GitHub API 上は SPDX 未分類）。"
    },
    {
      "url": "https://github.com/matplotlib/matplotlib/pull/31460",
      "kind": "translation_policy",
      "observed_at": "2026-08-03",
      "note_ja": "README の繁体字中国語訳 PR #31460 はマージされず close。メンテナ story645 は「メンテナが読めない言語の文書は検証も更新もできない」と難色を示し、timhoffm が「the decision is that we are not going to maintain multiple languages of development docs, which includes the README」と最終判断を明言。melissawm は Scientific Python translation effort への参加を代替として案内したが、同基盤の対象に matplotlib は含まれていない。"
    },
    {
      "url": "https://github.com/matplotlib/matplotlib/pull/31124",
      "kind": "ai_policy",
      "observed_at": "2026-08-03",
      "note_ja": "PR テンプレートに AI 利用開示(AI disclosure)欄を追加する PR #31124 が 2026-02-25 にマージ済み。貢献時は AI 利用の開示が求められる。"
    }
  ],
  "validation": [],
  "credit": {
    "expected": "unknown",
    "public_attribution": true
  },
  "provenance": {
    "revision": 2,
    "imported_from": null,
    "imported_at": "2026-08-02",
    "last_verified_at": "2026-08-03"
  },
  "workflow": {
    "platform": "github",
    "platform_url": null,
    "translation_repo": null
  },
  "content_type": "official_docs",
  "difficulty": {
    "score": 4,
    "factors": {
      "volume": "large",
      "workflow": "negotiated",
      "domain": "framework_docs"
    }
  },
  "community": {
    "japanese_team": "unknown",
    "team_url": null
  },
  "metrics": {
    "stars": 23057,
    "observed_at": "2026-08-03"
  }
}
