{
  "schema_version": "translation-task/v1",
  "id": "verify-scipy-scipy-org",
  "kind": "verification",
  "status": "needs_verification",
  "title": {
    "ja": "SciPy 公式サイトのドキュメント日本語化の検証",
    "en": null
  },
  "project": {
    "repository": "scipy/scipy.org",
    "url": "https://github.com/scipy/scipy.org",
    "category": "Python",
    "summary_ja": "科学計算ライブラリ SciPy の公式サイト。Scientific Python の Crowdin で翻訳され日本語は100%到達済みのため、機会は更新追随と品質改善が中心になる。",
    "license": null
  },
  "source": {
    "revision": null,
    "paths": []
  },
  "target": {
    "locale": "ja-JP",
    "paths": []
  },
  "permissions": {
    "translation": "unknown",
    "ai_assistance": "unknown",
    "pull_request": "unknown"
  },
  "automation": {
    "level": "discover_only",
    "allowed_actions": [
      "inspect_public_metadata",
      "find_translation_policy",
      "find_existing_work",
      "report_evidence"
    ]
  },
  "evidence": [
    {
      "url": "https://github.com/scipy/scipy.org",
      "kind": "repository",
      "observed_at": "2026-08-02",
      "note_ja": "リポジトリの存在と活動を確認。"
    }
  ],
  "validation": [],
  "credit": {
    "expected": "unknown",
    "public_attribution": true
  },
  "provenance": {
    "revision": 1,
    "imported_from": null,
    "imported_at": "2026-08-02",
    "last_verified_at": null
  },
  "workflow": {
    "platform": "crowdin",
    "platform_url": null,
    "translation_repo": null
  },
  "content_type": "official_docs",
  "difficulty": {
    "score": 1,
    "factors": {
      "volume": "small",
      "workflow": "platform",
      "domain": "framework_docs"
    }
  },
  "community": {
    "japanese_team": "unknown",
    "team_url": null
  }
}
