{
  "schema_version": "translation-task/v1",
  "id": "verify-open-telemetry-opentelemetry-io",
  "kind": "verification",
  "status": "needs_verification",
  "title": {
    "ja": "OpenTelemetry公式サイトのドキュメント日本語化の検証",
    "en": null
  },
  "project": {
    "repository": "open-telemetry/opentelemetry.io",
    "url": "https://github.com/open-telemetry/opentelemetry.io",
    "category": "Infrastructure",
    "summary_ja": "CNCFの可観測性フレームワークOpenTelemetryの公式サイト。ja localization制度が整備され日本語版が公開中。未翻訳・更新遅れページへの継続的な貢献余地が大きい。",
    "license": "CC-BY-4.0"
  },
  "source": {
    "revision": null,
    "paths": []
  },
  "target": {
    "locale": "ja-JP",
    "paths": []
  },
  "permissions": {
    "translation": "unknown",
    "ai_assistance": "unknown",
    "pull_request": "unknown"
  },
  "automation": {
    "level": "discover_only",
    "allowed_actions": [
      "inspect_public_metadata",
      "find_translation_policy",
      "find_existing_work",
      "report_evidence"
    ]
  },
  "evidence": [
    {
      "url": "https://github.com/open-telemetry/opentelemetry.io",
      "kind": "repository",
      "observed_at": "2026-08-02",
      "note_ja": "リポジトリの存在と活動を確認。"
    }
  ],
  "validation": [],
  "credit": {
    "expected": "unknown",
    "public_attribution": true
  },
  "provenance": {
    "revision": 1,
    "imported_from": null,
    "imported_at": "2026-08-02",
    "last_verified_at": null
  },
  "workflow": {
    "platform": "github",
    "platform_url": null,
    "translation_repo": null
  },
  "content_type": "official_docs",
  "difficulty": {
    "score": 4,
    "factors": {
      "volume": "large",
      "workflow": "direct_pr",
      "domain": "framework_docs"
    }
  },
  "community": {
    "japanese_team": "unknown",
    "team_url": null
  }
}
