{
  "schema_version": "translation-task/v1",
  "id": "verify-pola-rs-polars",
  "kind": "verification",
  "status": "needs_verification",
  "title": {
    "ja": "Polars のドキュメント日本語化の検証",
    "en": null
  },
  "project": {
    "repository": "pola-rs/polars",
    "url": "https://github.com/pola-rs/polars",
    "category": "Python",
    "summary_ja": "Rust 製の高速 DataFrame ライブラリ。本家に公式の翻訳受付方針は確認できず、ユーザーガイドの日本語訳はコミュニティの polars-ja/docs-ja が担っていたが2024年7月以降停滞。翻訳の追随・再活性化や公式化の交渉余地があるものの、確立した貢献経路は未確認。",
    "license": "MIT"
  },
  "source": {
    "revision": null,
    "paths": [
      "docs"
    ]
  },
  "target": {
    "locale": "ja-JP",
    "paths": []
  },
  "permissions": {
    "translation": "unknown",
    "ai_assistance": "unknown",
    "pull_request": "unknown"
  },
  "automation": {
    "level": "discover_only",
    "allowed_actions": [
      "inspect_public_metadata",
      "find_translation_policy",
      "find_existing_work",
      "report_evidence"
    ]
  },
  "evidence": [
    {
      "url": "https://github.com/pola-rs/polars",
      "kind": "repository",
      "observed_at": "2026-08-03",
      "note_ja": "リポジトリは活発(最終push 2026-08-01、非archived、MIT)。issue検索では翻訳・日本語化に関する方針や受付窓口は見当たらず、公式のローカライズ制度は確認できない。"
    },
    {
      "url": "https://github.com/polars-ja/docs-ja",
      "kind": "team_activity",
      "observed_at": "2026-08-03",
      "note_ja": "コミュニティ日本語訳リポジトリ polars-ja/docs-ja の最終pushは2024-07-02で1年以上停滞。活発な日本語チームは確認できない。"
    }
  ],
  "validation": [],
  "credit": {
    "expected": "unknown",
    "public_attribution": true
  },
  "provenance": {
    "revision": 1,
    "imported_from": null,
    "imported_at": "2026-08-02",
    "last_verified_at": null
  },
  "workflow": {
    "platform": "github",
    "platform_url": null,
    "translation_repo": "polars-ja/docs-ja"
  },
  "content_type": "official_docs",
  "difficulty": {
    "score": 4,
    "factors": {
      "volume": "medium",
      "workflow": "fork_hosted",
      "domain": "framework_docs"
    }
  },
  "metrics": {
    "stars": 39163,
    "observed_at": "2026-08-03"
  },
  "community": {
    "japanese_team": "inactive",
    "team_url": "https://github.com/polars-ja/docs-ja"
  }
}
