{
  "schema_version": "translation-task/v1",
  "id": "verify-chartjs-chart-js",
  "kind": "verification",
  "status": "needs_verification",
  "title": {
    "ja": "chartjs/Chart.js の日本語化参加方法を再検証",
    "en": "Re-verify the Japanese translation workflow for chartjs/Chart.js"
  },
  "project": {
    "repository": "chartjs/Chart.js",
    "url": "https://github.com/chartjs/Chart.js",
    "category": "JavaScript",
    "summary_ja": "シンプルなチャートライブラリ。ドキュメントは docs/ 配下(VuePress)の英語のみで i18n 機構はなく、翻訳受付方針も明文化されていない。過去にリポジトリ内への中国語訳追加 PR がメンテナ不在を理由に受け入れられなかった経緯があり、現行 README に翻訳版へのリンク節も存在しない。日本語化するならメンテナへの提案・交渉が前提。",
    "license": "MIT"
  },
  "source": {
    "revision": null,
    "paths": [
      "docs/"
    ]
  },
  "target": {
    "locale": "ja-JP",
    "paths": []
  },
  "permissions": {
    "translation": "unknown",
    "ai_assistance": "unknown",
    "pull_request": "unknown"
  },
  "automation": {
    "level": "discover_only",
    "allowed_actions": [
      "inspect_public_metadata",
      "find_translation_policy",
      "find_existing_work",
      "report_evidence"
    ]
  },
  "evidence": [
    {
      "url": "https://github.com/chartjs/Chart.js",
      "kind": "repository",
      "observed_at": "2025-12-31",
      "note_ja": "旧一覧に掲載されていたrepository。翻訳方針の根拠としては未検証。"
    },
    {
      "url": "https://github.com/chartjs/Chart.js",
      "kind": "repository",
      "observed_at": "2026-08-03",
      "note_ja": "アーカイブされておらず 2026-05-27 まで更新あり(Star 67,619、MIT)。ドキュメントは docs/ 配下の VuePress 製で英語のみ。README・CONTRIBUTING・docs/developers/contributing.md のいずれにも翻訳への言及はなく、現行 README には旧一覧にあった中国語訳リンクも見当たらない。日本語翻訳に関する open issue / PR もなし。"
    },
    {
      "url": "https://github.com/chartjs/Chart.js/pull/4281",
      "kind": "pull_request",
      "observed_at": "2026-08-03",
      "note_ja": "2017 年に docs/zhCN/ へ中国語訳を追加する PR が、リポジトリ内翻訳はメンテナ不在との理由で merge されず close された経緯(旧一覧の記載どおり)。以後も翻訳受付方針の明文化は確認できず、permissions.translation は unknown のまま。"
    },
    {
      "url": "https://www.chartjs.org/docs/latest/",
      "kind": "platform",
      "observed_at": "2026-08-03",
      "note_ja": "公式サイト側を再調査。docs サイト(VuePress)に言語切替・翻訳版へのリンク・localization への言及はなく、フッターは最終更新日時と前後ページリンクのみ。"
    },
    {
      "url": "https://github.com/orgs/chartjs/repositories",
      "kind": "repository",
      "observed_at": "2026-08-03",
      "note_ja": "chartjs org のリポジトリ一覧を確認したが、docs 翻訳用・i18n 系のリポジトリは存在しない(website は www.chartjs.org リポジトリのみ)。Chart.js 本体の issue 検索でも翻訳受付に関する提案・回答は見つからなかった。結論: 公式の翻訳受付経路は確認できなかった(2026-08-03)。needs_verification を維持。"
    }
  ],
  "validation": [],
  "credit": {
    "expected": "unknown",
    "public_attribution": true
  },
  "provenance": {
    "revision": 2,
    "imported_from": "docs/legacy-list.md",
    "imported_at": "2026-07-25",
    "last_verified_at": "2026-08-03"
  },
  "workflow": {
    "platform": "github",
    "platform_url": "https://github.com/chartjs/Chart.js",
    "translation_repo": null
  },
  "content_type": "official_docs",
  "difficulty": {
    "score": 3,
    "factors": {
      "volume": "medium",
      "workflow": "negotiated",
      "domain": "framework_docs"
    }
  },
  "metrics": {
    "stars": 67619,
    "observed_at": "2026-08-03"
  },
  "community": {
    "japanese_team": "none",
    "team_url": null
  },
  "legacy": {
    "概要": "シンプルなチャートライブラリ",
    "作者": "[Chart.js](https://github.com/chartjs)",
    "開始年月": "2013/03",
    "ライセンス": "MIT",
    "やり方": "翻訳ページを作ってリンクだけプルリク。[中国語のプルリク](https://github.com/chartjs/Chart.js/pull/4281)参照",
    "状態": "中国語だけリンク作ってもらっている。翻訳フォルダはメンテナがいないという理由で却下。",
    "文章量": "中",
    "Star": "66,943"
  }
}
