{
  "schema_version": "translation-task/v1",
  "id": "verify-scikit-learn-scikit-learn",
  "kind": "verification",
  "status": "needs_verification",
  "title": {
    "ja": "scikit-learn のドキュメント日本語化の検証",
    "en": null
  },
  "project": {
    "repository": "scikit-learn/scikit-learn",
    "url": "https://github.com/scikit-learn/scikit-learn",
    "category": "Python",
    "summary_ja": "機械学習ライブラリの定番。公式の日本語訳はないが、Discussion #28105 でサイト翻訳が議論されており、Scientific Python 基盤への合流を含め交渉の余地がある。",
    "license": "BSD-3-Clause"
  },
  "source": {
    "revision": null,
    "paths": []
  },
  "target": {
    "locale": "ja-JP",
    "paths": []
  },
  "permissions": {
    "translation": "unknown",
    "ai_assistance": "unknown",
    "pull_request": "unknown"
  },
  "automation": {
    "level": "discover_only",
    "allowed_actions": [
      "inspect_public_metadata",
      "find_translation_policy",
      "find_existing_work",
      "report_evidence"
    ]
  },
  "evidence": [
    {
      "url": "https://github.com/scikit-learn/scikit-learn",
      "kind": "repository",
      "observed_at": "2026-08-02",
      "note_ja": "リポジトリの存在と活動を確認。"
    }
  ],
  "validation": [],
  "credit": {
    "expected": "unknown",
    "public_attribution": true
  },
  "provenance": {
    "revision": 1,
    "imported_from": null,
    "imported_at": "2026-08-02",
    "last_verified_at": null
  },
  "workflow": {
    "platform": "github",
    "platform_url": null,
    "translation_repo": null
  },
  "content_type": "official_docs",
  "difficulty": {
    "score": 4,
    "factors": {
      "volume": "large",
      "workflow": "negotiated",
      "domain": "framework_docs"
    }
  },
  "community": {
    "japanese_team": "unknown",
    "team_url": null
  }
}
